{
	"schemaVersion": 1,
	"projectId": "my-project",
	"source": ".",
	"engine": "auto",
	"timeoutMs": 3600000,
	"features": {
		"git": true,
		"dynamicDisplayName": true,
		"editTargetPaths": true,
		"continueOnError": true,
		"dryRunDefault": true
	},
	"exclusions": {
		"directoryNames": [
			".cache"
		],
		"relativePaths": [
			"build",
			"dev/out"
		],
		"fileNames": [
			".DS_Store"
		]
	},
	"targets": [
		{
			"id": "primary",
			"label": "NAS 1",
			"path": "/mnt/nas-one/backup/my-project",
			"selected": true
		},
		{
			"id": "secondary",
			"label": "NAS 2",
			"path": "/mnt/nas-two/backup/my-project",
			"selected": false
		},
		{
			"id": "archive",
			"label": "Archive",
			"path": "/mnt/nas-three/backup/my-project",
			"selected": false
		}
	],
	"displayName": {
		"version": true,
		"commit": false,
		"changes": false,
		"lastBackup": false
	},
	"backup": {
		"mode": "fixed",
		"format": "directory"
	},
	"schedule": {
		"enabled": false,
		"cron": "0 2 * * *",
		"dryRun": true
	}
}
